2024-09-05 12:52:46,832 - Packet: Ether / IP / TCP 192.168.1.200:12345 > 192.168.1.100:http S / Raw
2024-09-05 12:52:46,832 - Malicious Packet: Ether / IP / TCP 192.168.1.200:12345 > 192.168.1.100:http S / Raw
2024-09-05 12:52:47,834 - Packet: Ether / IP / TCP 192.168.1.200:12345 > 192.168.1.100:http S / Raw
2024-09-05 12:52:47,834 - Malicious Packet: Ether / IP / TCP 192.168.1.200:12345 > 192.168.1.100:http S / Raw
2024-09-05 12:52:48,836 - Packet: Ether / IP / TCP 192.168.1.200:12345 > 192.168.1.100:http S / Raw
2024-09-05 12:52:48,836 - Malicious Packet: Ether / IP / TCP 192.168.1.200:12345 > 192.168.1.100:http S / Raw
2024-09-05 12:52:49,837 - Packet: Ether / IP / TCP 192.168.1.200:12345 > 192.168.1.100:http S / Raw
2024-09-05 12:52:49,841 - Malicious Packet: Ether / IP / TCP 192.168.1.200:12345 > 192.168.1.100:http S / Raw
